{
  "$schema": "../../schemas/assurance-profile.schema.json",
  "overlay_id": "EAP-L1-overlay",
  "assurance_level": "EAP-L1",
  "title": "EAP-L1 \u2014 Enterprise Baseline Overlay",
  "version": "0.3.0",
  "description": "Machine-readable overlay defining the control applicability, evidence tightening, and dependency rules for EAP-L1 (Enterprise Baseline). Intended use: internal copilots and constrained workflow assistance with low-to-medium impact actions.",
  "applicable_controls": [
    {
      "control_id": "EAP-CTRL-001",
      "applicable": true,
      "normative_strength_override": "MUST",
      "note": "Simplified chain acceptable at L1. Full append-only hash-chained log required at L2+.",
      "evidence_tightening": null,
      "dependency_rules": [
        "EAP-CTRL-002",
        "EAP-CTRL-003"
      ]
    },
    {
      "control_id": "EAP-CTRL-002",
      "applicable": true,
      "normative_strength_override": "MUST",
      "note": null,
      "evidence_tightening": null,
      "dependency_rules": []
    },
    {
      "control_id": "EAP-CTRL-003",
      "applicable": true,
      "normative_strength_override": "MUST",
      "note": null,
      "evidence_tightening": null,
      "dependency_rules": []
    },
    {
      "control_id": "EAP-CTRL-004",
      "applicable": true,
      "normative_strength_override": "SHOULD",
      "note": "SHOULD at L1; MUST at L2+.",
      "evidence_tightening": null,
      "dependency_rules": []
    },
    {
      "control_id": "EAP-CTRL-005",
      "applicable": false,
      "normative_strength_override": null,
      "note": "Not applicable at L1.",
      "evidence_tightening": null,
      "dependency_rules": []
    },
    {
      "control_id": "EAP-CTRL-006",
      "applicable": false,
      "normative_strength_override": null,
      "note": "Not applicable at L1.",
      "evidence_tightening": null,
      "dependency_rules": []
    },
    {
      "control_id": "EAP-CTRL-007",
      "applicable": true,
      "normative_strength_override": "MUST",
      "note": null,
      "evidence_tightening": null,
      "dependency_rules": [
        "EAP-CTRL-008"
      ]
    },
    {
      "control_id": "EAP-CTRL-008",
      "applicable": true,
      "normative_strength_override": "MUST",
      "note": null,
      "evidence_tightening": null,
      "dependency_rules": []
    },
    {
      "control_id": "EAP-CTRL-009",
      "applicable": false,
      "normative_strength_override": null,
      "note": "Not applicable at L1.",
      "evidence_tightening": null,
      "dependency_rules": []
    },
    {
      "control_id": "EAP-CTRL-010",
      "applicable": true,
      "normative_strength_override": "SHOULD",
      "note": "SHOULD at L1; MUST at L2+.",
      "evidence_tightening": null,
      "dependency_rules": [
        "EAP-CTRL-011"
      ]
    },
    {
      "control_id": "EAP-CTRL-011",
      "applicable": true,
      "normative_strength_override": "MUST",
      "note": null,
      "evidence_tightening": null,
      "dependency_rules": []
    },
    {
      "control_id": "EAP-CTRL-012",
      "applicable": true,
      "normative_strength_override": "SHOULD",
      "note": "SHOULD at L1; MUST at L2+.",
      "evidence_tightening": null,
      "dependency_rules": []
    },
    {
      "control_id": "EAP-CTRL-013",
      "applicable": false,
      "normative_strength_override": null,
      "note": "Not applicable at L1.",
      "evidence_tightening": null,
      "dependency_rules": []
    },
    {
      "control_id": "EAP-CTRL-014",
      "applicable": true,
      "normative_strength_override": "SHOULD",
      "note": "SHOULD at L1; MUST at L2+.",
      "evidence_tightening": null,
      "dependency_rules": []
    },
    {
      "control_id": "EAP-CTRL-015",
      "applicable": true,
      "normative_strength_override": "SHOULD",
      "note": "Annually recommended at L1. At least twice yearly mandatory at L2+.",
      "evidence_tightening": null,
      "dependency_rules": []
    },
    {
      "control_id": "EAP-CTRL-016",
      "applicable": false,
      "normative_strength_override": null,
      "note": "Not applicable at L1.",
      "evidence_tightening": null,
      "dependency_rules": []
    },
    {
      "control_id": "EAP-CTRL-017",
      "applicable": true,
      "normative_strength_override": "MUST",
      "note": null,
      "evidence_tightening": null,
      "dependency_rules": []
    },
    {
      "control_id": "EAP-CTRL-018",
      "applicable": true,
      "normative_strength_override": "SHOULD",
      "note": "Basic SoD between Policy Owner and Evidence Custodian recommended at L1; MUST at L2+.",
      "evidence_tightening": null,
      "dependency_rules": []
    },
    {
      "control_id": "EAP-CTRL-019",
      "applicable": false,
      "normative_strength_override": null,
      "note": "Not applicable at L1.",
      "evidence_tightening": null,
      "dependency_rules": []
    },
    {
      "control_id": "EAP-CTRL-020",
      "applicable": false,
      "normative_strength_override": null,
      "note": "Not applicable at L1.",
      "evidence_tightening": null,
      "dependency_rules": []
    }
  ],
  "mandatory_control_ids": [
    "EAP-CTRL-001",
    "EAP-CTRL-002",
    "EAP-CTRL-003",
    "EAP-CTRL-007",
    "EAP-CTRL-008",
    "EAP-CTRL-011",
    "EAP-CTRL-017"
  ],
  "pass_criteria": "All mandatory controls assessed as 'pass' or 'waived' with documented waiver. SHOULD controls documented with rationale if not met."
}
